{
  "ir_version": "1.0",
  "compiler_version": "1.1",
  "artifact_type": "doctype_inventory",
  "generated_at": "2026-06-25T10:19:35Z",
  "repository_commit": "f95b4fe91f273f7a6745f2f7d1de4733757db2dd",
  "provenance": {
    "artifact_id": "ART-DOCTYPE-INV-00001",
    "produced_by": "Phase0_Discovery",
    "consumes": [
      "apps/smriti_retail_os"
    ],
    "used_by": [
      "docs_renderers",
      "dependency_graph"
    ]
  },
  "data": [
    {
      "artifact_id": "ART-DOCTYPE-00001",
      "doctype_name": "PSV Channel Partner",
      "evidence_type": "JSON",
      "schema_path": "apps/smriti_retail_os/smriti_retail_os/smriti_retail_os/doctype/psv_channel_partner/psv_channel_partner.json",
      "checksum": "30096a5d5f3d87f8ef36115a4ca4752e8f55f70ac786535e67c0f0b4f5caa40c",
      "fields": [
        {
          "fieldname": "company",
          "label": "Company",
          "fieldtype": "Link",
          "mandatory": 1
        },
        {
          "fieldname": "customer",
          "label": "Customer",
          "fieldtype": "Link",
          "mandatory": 1
        },
        {
          "fieldname": "location_name",
          "label": "Location Name",
          "fieldtype": "Data",
          "mandatory": 1
        },
        {
          "fieldname": "territory",
          "label": "Territory",
          "fieldtype": "Link",
          "mandatory": 1
        },
        {
          "fieldname": "zone",
          "label": "Zone",
          "fieldtype": "Select",
          "mandatory": 0
        },
        {
          "fieldname": "region",
          "label": "Region",
          "fieldtype": "Data",
          "mandatory": 0
        },
        {
          "fieldname": "area_manager",
          "label": "Area Manager",
          "fieldtype": "Link",
          "mandatory": 0
        },
        {
          "fieldname": "effective_from",
          "label": "Effective From",
          "fieldtype": "Date",
          "mandatory": 0
        },
        {
          "fieldname": "effective_to",
          "label": "Effective To",
          "fieldtype": "Date",
          "mandatory": 0
        },
        {
          "fieldname": "contact_person",
          "label": "Contact Person",
          "fieldtype": "Data",
          "mandatory": 0
        },
        {
          "fieldname": "mobile",
          "label": "Mobile",
          "fieldtype": "Data",
          "mandatory": 0
        },
        {
          "fieldname": "email",
          "label": "Email",
          "fieldtype": "Data",
          "mandatory": 0
        },
        {
          "fieldname": "active",
          "label": "Active",
          "fieldtype": "Check",
          "mandatory": 0
        },
        {
          "fieldname": "status",
          "label": "Status",
          "fieldtype": "Select",
          "mandatory": 0
        },
        {
          "fieldname": "primary_brand",
          "label": "Primary Brand",
          "fieldtype": "Data",
          "mandatory": 0
        },
        {
          "fieldname": "brands",
          "label": "Brands",
          "fieldtype": "Table",
          "mandatory": 0
        }
      ]
    },
    {
      "artifact_id": "ART-DOCTYPE-00002",
      "doctype_name": "PSV Channel Partner Brand",
      "evidence_type": "JSON",
      "schema_path": "apps/smriti_retail_os/smriti_retail_os/smriti_retail_os/doctype/psv_channel_partner_brand/psv_channel_partner_brand.json",
      "checksum": "2453f492e45c7e55d16d9b03dababbd3cc605b35119e048eb219bcd91e2649de",
      "fields": [
        {
          "fieldname": "brand",
          "label": "Brand",
          "fieldtype": "Link",
          "mandatory": 1
        },
        {
          "fieldname": "is_primary",
          "label": "Is Primary",
          "fieldtype": "Check",
          "mandatory": 0
        }
      ]
    },
    {
      "artifact_id": "ART-DOCTYPE-00003",
      "doctype_name": "PSV Ledger Entry",
      "evidence_type": "JSON",
      "schema_path": "apps/smriti_retail_os/smriti_retail_os/smriti_retail_os/doctype/psv_ledger_entry/psv_ledger_entry.json",
      "checksum": "03ce4d4773e8b3fcc204f3cc15b448c8b129e8ec67e5dd0e7ffb332e8b8f4176",
      "fields": [
        {
          "fieldname": "company",
          "label": "Company",
          "fieldtype": "Link",
          "mandatory": 1
        },
        {
          "fieldname": "posting_datetime",
          "label": "Posting Datetime",
          "fieldtype": "Datetime",
          "mandatory": 1
        },
        {
          "fieldname": "channel_partner",
          "label": "Channel Partner",
          "fieldtype": "Link",
          "mandatory": 1
        },
        {
          "fieldname": "item_variant",
          "label": "Item Variant",
          "fieldtype": "Link",
          "mandatory": 1
        },
        {
          "fieldname": "qty",
          "label": "Quantity",
          "fieldtype": "Float",
          "mandatory": 1
        },
        {
          "fieldname": "transaction_type",
          "label": "Transaction Type",
          "fieldtype": "Select",
          "mandatory": 1
        },
        {
          "fieldname": "voucher_type",
          "label": "Voucher Type",
          "fieldtype": "Data",
          "mandatory": 0
        },
        {
          "fieldname": "voucher_no",
          "label": "Voucher No",
          "fieldtype": "Data",
          "mandatory": 0
        },
        {
          "fieldname": "unique_hash",
          "label": "Unique Hash",
          "fieldtype": "Data",
          "mandatory": 0
        },
        {
          "fieldname": "reversal_of",
          "label": "Reversal Of",
          "fieldtype": "Link",
          "mandatory": 0
        },
        {
          "fieldname": "reversal_reason",
          "label": "Reversal Reason",
          "fieldtype": "Small Text",
          "mandatory": 0
        },
        {
          "fieldname": "warehouse",
          "label": "Warehouse",
          "fieldtype": "Link",
          "mandatory": 0
        },
        {
          "fieldname": "currency",
          "label": "Currency",
          "fieldtype": "Link",
          "mandatory": 0
        },
        {
          "fieldname": "fiscal_year",
          "label": "Fiscal Year",
          "fieldtype": "Link",
          "mandatory": 0
        },
        {
          "fieldname": "hash_version",
          "label": "Hash Version",
          "fieldtype": "Int",
          "mandatory": 0
        }
      ]
    },
    {
      "artifact_id": "ART-DOCTYPE-00004",
      "doctype_name": "PSV Reorder Rule",
      "evidence_type": "JSON",
      "schema_path": "apps/smriti_retail_os/smriti_retail_os/smriti_retail_os/doctype/psv_reorder_rule/psv_reorder_rule.json",
      "checksum": "ae2c3b5b5f0597a28befbc020972c58bc1cc5a11b46babfcbb9d4dda3da3e48a",
      "fields": [
        {
          "fieldname": "active",
          "label": "Is Active",
          "fieldtype": "Check",
          "mandatory": 0
        },
        {
          "fieldname": "customer",
          "label": "Channel",
          "fieldtype": "Link",
          "mandatory": 1
        },
        {
          "fieldname": "item_template",
          "label": "Style/Template",
          "fieldtype": "Link",
          "mandatory": 1
        },
        {
          "fieldname": "column_break_rules",
          "label": "",
          "fieldtype": "Column Break",
          "mandatory": 0
        },
        {
          "fieldname": "core_sizes",
          "label": "Core Sizes",
          "fieldtype": "Data",
          "mandatory": 1
        },
        {
          "fieldname": "target_qty",
          "label": "Target Quantity (Per Variant)",
          "fieldtype": "Float",
          "mandatory": 1
        }
      ]
    },
    {
      "artifact_id": "ART-DOCTYPE-00005",
      "doctype_name": "PSV Stock Aging Snapshot",
      "evidence_type": "JSON",
      "schema_path": "apps/smriti_retail_os/smriti_retail_os/smriti_retail_os/doctype/psv_stock_aging_snapshot/psv_stock_aging_snapshot.json",
      "checksum": "2a01042168f9119bbb683df07b340fb12d97d40e67d73b35260314b596650ecc",
      "fields": [
        {
          "fieldname": "snapshot_date",
          "label": "Snapshot Date",
          "fieldtype": "Date",
          "mandatory": 1
        },
        {
          "fieldname": "channel_partner",
          "label": "Channel Partner",
          "fieldtype": "Link",
          "mandatory": 1
        },
        {
          "fieldname": "item_variant",
          "label": "Item Variant",
          "fieldtype": "Link",
          "mandatory": 1
        },
        {
          "fieldname": "qty",
          "label": "Total Quantity",
          "fieldtype": "Float",
          "mandatory": 0
        },
        {
          "fieldname": "brand_name",
          "label": "Brand Name",
          "fieldtype": "Data",
          "mandatory": 0
        },
        {
          "fieldname": "item_group_name",
          "label": "Item Group Name",
          "fieldtype": "Data",
          "mandatory": 0
        },
        {
          "fieldname": "territory_name",
          "label": "Territory Name",
          "fieldtype": "Data",
          "mandatory": 0
        },
        {
          "fieldname": "qty_0_30",
          "label": "0-30 Days Qty",
          "fieldtype": "Float",
          "mandatory": 0
        },
        {
          "fieldname": "qty_31_60",
          "label": "31-60 Days Qty",
          "fieldtype": "Float",
          "mandatory": 0
        },
        {
          "fieldname": "qty_61_90",
          "label": "61-90 Days Qty",
          "fieldtype": "Float",
          "mandatory": 0
        },
        {
          "fieldname": "qty_91_180",
          "label": "91-180 Days Qty",
          "fieldtype": "Float",
          "mandatory": 0
        },
        {
          "fieldname": "qty_180_plus",
          "label": "180+ Days Qty",
          "fieldtype": "Float",
          "mandatory": 0
        },
        {
          "fieldname": "aging_alert",
          "label": "Aging Alert",